text,emotion
i crave something thrilling and mysterious tonight,mystery
"Work was rough, I’m stressed and craving something chill",stressed
"Let’s watch a goofy comedy, I could use laughs",comedy
want a suspenseful mystery with twists,mystery
just need something funny to lift me,comedy
I’m in a tense mood and want a thriller vibe,horror
In the mood for a spooky horror flick,horror
feels like a perfect action pack night,horror
looking for a lighthearted chick flick,comedy
"Romantic mood in the air, need a heartfelt tale",romantic
I’m in the mood for a heartwarming romance,romantic
"my heart aches, could use a romantic vibe",romantic
I’m in the mood for a tense thriller,mystery
"Nervous and sad, looking for a comforting story",sad
"feeling hopeful, think a feel-good film could help",uplifting
"laughing at goofy stuff, bring on the comedy",comedy
totally exhausted need rest and a vibe reset,tired
"I am so angry right now, need something light",angry
 craving a suspenseful mystery thriller,mystery
in the mood for a spooky horror showdown,horror
"could use a quiet night in, peaceful vibes",calm
"I feel angry about the latest news, need distraction",angry
Feeling hopeful and want an uplifting story,uplifting
cranky and tired after a long day,tired
Mystery movie night would be perfect right now,mystery
In the mood for romance and warm feelings,romantic
looking for a quirky comedy to lift mood,comedy
"Calm night in sounds nice, maybe a gentle drama",calm
"tired of chaos, want simple comfort",calm
feeling great and wanna chat about movies,happy
horror that actually nails the scare factor,horror
I’m craving quirky humor and easygoing vibes,comedy
give me something thrilling and mysterious tonight,mystery
"feeling hopeful and content, share something sweet",happy
I’m feeling happy today and want something light,happy
"Feeling happy after the win, want an upbeat flick",happy
I want a romantic night in with a good movie,romantic
"Calm and cozy vibes, maybe a light drama",calm
"calm and cozy, maybe something light and chill",calm
totally wiped out just need a nap soon,tired
feeling hopeful about new plans,uplifting
I crave a mystery with clever twists,mystery
"I’m not sure what to watch, maybe a mix of genres",mystery
I want to watch a romantic movie tonight,romantic
In the mood for a creepy horror setup,horror
"Work was stressful, need something relaxing",stressed
"current vibe is stressed, need a break",stressed
like something thrilling but not scary,mystery
feeling great and need some laughs,happy
need something light and funny right now,comedy
I am really sad and could use some comfort,sad
"stressed out, looking for a thriller to distract me",stressed
"Feeling sad, hoping for a tearjerker to connect",sad
want something light and romantic tonight,romantic
"spooky vibes needed, something scary please",horror
weekend mood: relaxed and easygoing,calm
let's escape into a suspenseful mystery film,mystery
I feel content and want something gentle,calm
so hype about this new comedy release,comedy
im feeling stressed and could use a gentle comedy,stressed
"feeling buoyant, bring on something fun",happy
I want something charming and romantic tonight,romantic
need something heartwarming and kind,calm
"I’m worn out and want a soft, comforting film",calm
"man, I’m so angry rn, inner peace please",angry
"unsettled by the news, need a creepy movie",horror
totally exhausted need a nap and space,tired
vindicated and happy after that win,happy
i feel happy but bored and want something engaging,happy
Lighthearted comedy would be perfect right now,comedy
feeling great and could use a chill chat,happy
"refreshed after a long break, ready for something nice",calm
"I’m really angry after that call, need a time-out",angry
"Curious for a mystery, something puzzling and cool",mystery
" Anger bubbled up, I want something cathartic and funny",angry
this is tense can't wait for something thrilling,mystery
"feeling hopeful, a little inspired",uplifting
I’m annoyed and want a tense mystery to solve,mystery
"So sad right now, seeking a comforting story",sad
"Feeling tired after a long day, need a chill show",tired
i just want a feel-good film,uplifting
"That movie looks hilarious, I’m in",comedy
romantic mood anything sweet and cute,romantic
this day has been chaotic and draining,stressed
I feel nostalgic and crave a romantic film,romantic
need something light and funny now,comedy
"Angry at the latest news, craving a thrilling ride",angry
"I’m exhausted and just want a long, comforting film",tired
craving a chill night and good vibes,calm
needing a good cry with a heartfelt drama,sad
I’m curious and want a mind-bending mystery,mystery
I want a lighthearted comedy to unwind,comedy
need a good cry session and vent,sad
"I am tired after a long day, craving something soothing",tired
craving a light funny movie,comedy
want a heartwarming uplifting story,uplifting
want a big laugh and silly moments,comedy
"so tired after work, need a chill night",tired
some witty comedy would lift me up,comedy
"chill and relaxed, craving slow drama",calm
send me a heartwarming film to brighten the day,uplifting
looking for something adventurous yet fun,happy
"feeling nostalgic, seek a heartfelt drama",sad
i feel calm and collected right now,calm
"weekend energy up, want something goofy",comedy
I’m anxious and need a tense horror to escape,horror
totally exhausted and in need of rest,tired
"craving a gripping thriller, surprise me",mystery
that plot twist better blow my mind,mystery
"I’m in the mood for a hopeful, uplifting story",uplifting
"frustrated, give me an epic battle sequence",angry
"super inspired, craving uplifting and hopeful films",uplifting
I’m in a relaxed mood and want something calm,calm
"feeling hopeful and bright, need a feel-good film",uplifting
craving a feel-good movie to smile about,happy
thinking about a lighthearted buddy comedy,comedy
a spooky horror to shake me up,horror
Honestly I'm feeling kinda tired after work,tired
want something thrilling and mysterious tonight,mystery
"I am so tired after work, need something relaxing",tired
"Stressed from deadlines, need a quick escape",stressed
let’s cuddle and stream a romantic film,romantic
a good laugh would fix this mood,comedy
"feeling kinda hopeful, maybe a funny movie night",uplifting
"i’m furious, need a loud action flick",angry
"Work has me stressed, need something calming",stressed
Today was rough; I want something soothing,calm
seeking clever twists and clever clues,mystery
I’m anxious and craving a suspenseful thriller,mystery
"Frustration builds up, need a cathartic action flick",angry
tired and craving a soothing drama,calm
Craving a clever mystery with twists and clues,mystery
I’m irritated and want something light and silly,angry
I’m happy and craving a feel-good romcom,happy
"ugh this day sucked, craving a good laugh",comedy
"dead tired after practice, craving a feel good flick",uplifting
"my nerves are fried, need something tense",horror
Feeling uplifted and want something inspiring,uplifting
i want a cozy romance with warm vibes,romantic
that horror vibe would hit hard tonight,horror
desiring a tender romantic drama tonight,romantic
"calm evening, simple and soothing storytelling",calm
I’m sad and could use a comforting story,sad
"call it a comedy night, laugh till we drop",comedy
want something suspenseful not too scary,horror
"super pissed about that mess, need space",angry
"need a good cry session, honestly",sad
totally into a spooky chill night,horror
"Trying to unwind, I want a funny film to smile about",comedy
"Can't shake this fear, craving a scary thriller",horror
I’m craving goofy humor and silly antics,comedy
"I feel grateful and want a peaceful, uplifting story",uplifting
"feels like a rollercoaster day, wow",stressed
"Horror vibes tonight, give me something atmospheric",horror
I’m in the mood for romance and cozy vibes,romantic
"Tired after a long day, craving calm vibes",tired
"Feeling tired after a long day, need a cozy film",tired
I think I want something light and funny tonight,comedy
"pumped and energized, want a heroic adventure",happy
Watching a heartwarming romance sounds perfect,romantic
Dark and serious vibes with clever twists,mystery
"Feeling content and light, craving a fun comedy",comedy
"Feeling uplifting today, want something inspiring",uplifting
I want to watch a horror movie tonight,horror
"midday slump, need a chill movie pick",calm
i could use a feel‑good comedy right now,comedy
"planning a cozy date night, dreamy vibes",romantic
i am really sad and need some comfort,sad
"I’m tired after a long day, just want something chill",tired
I’m in the mood for a romantic movie tonight,romantic
I could use a horror scare to wake up,horror
"feeling weepy and hopeful, maybe a love story",romantic
could use a thrilling mystery right now,mystery
craving something thrilling and mysterious tonight,mystery
"calm and cozy, craving a quiet movie night",calm
"That movie ending made me angry, need a break",angry
Curious about a mystery movie to keep me guessing,mystery
feels like a perfect cozy night,calm
"Today was wild, I’m feeling uplifting and hopeful",uplifting
"I want a tense horror night, lots of suspense",horror
"want something eerie and suspenseful, please",mystery
I am exhausted and crave a quiet drama,tired
I want a feel-good movie to lift me,uplifting
I am curious about a mysterious thriller tonight,mystery
"rage building, need something cathartic to watch",angry
stunned by the latest plot twist,horror
"this is adorable, want a romcom binge",romantic
give me something light and funny please,comedy
"today feels uplifting, want something inspiring",uplifting
that movie would be so heartwarming,uplifting
"I want a scary film tonight, horror sounds perfect",horror
this day is stressing me out help,stressed
I am tired after work and craving something relaxing,tired
in the mood for a creepy horror flick,horror
give me a scary movie to scare the crap out,horror
"gotta have a scare, a solid horror story",horror
Trying to solve a puzzling mystery on screen,mystery
"psst, craving a clever plot twist",mystery
"just want a calm, soothing story",calm
hype for a clever mystery mystery vibes,mystery
"feeling great, want to laugh with friends",happy
"That scene made me sad, need a uplifting pick",uplifting
"I could use a funny show, comedy all the way",comedy
"I want a romantic movie tonight, something sweet",romantic
"this day is rough, want a fun escape",stressed
"Low energy day, looking for a soothing drama",calm
want something eerie and scary,horror
i’m anxious yet hopeful for something inspiring,uplifting
Feeling calm and looking for a cozy film,calm
Feeling content and want a romantic story,romantic
I feel stressed after work and want something relaxing,stressed
let’s watch something inspiring and uplifting,uplifting
"Feeling hopeful and want a pleasant, cheerful film",happy
need a cinematic escape that leaves me inspired,uplifting
this song makes me feel nostalgic and happy,happy
i’m in the mood for a feel-good comedy,comedy
"burning out lately, could use a comforting film",calm
"Feeling brave, want a dark psychological thriller",horror
I need something sweet and romantic tonight,romantic
"Today felt exhausting, looking for mellow entertainment",calm
in the mood for something sweet and romantic,romantic
I am furious and could use a tense action flick,angry
I’m tired and craving a lighthearted comedy,comedy
"Feeling uplifted, craving something light and funny",uplifting
feeling curious and ready for a puzzling plot,mystery
I could go for a creepy ghost story,horror
uplifting stories always lift my spirits,uplifting
"Overwhelmed by deadlines, need a relaxing escape",stressed
"so mad right now, gonna vent a bit",angry
"everything feels off, need something suspenseful",mystery
"I’m tense and want a tense, dramatic film",horror
let’s watch something sweet and hopeful,uplifting
totally exhausted need some rest and a movie,tired
feeling great and ready to laugh together,happy
I’d love a comedy with witty banter,comedy
I want a big laugh and goofy moments,comedy
uplifting vibes are everything after a long week,uplifting
"I'm angry about that drama, need something funny",angry
"I’m slow to wake up, just want something lighthearted",calm
I am so tired and just need a break,tired
"totally exhausted, need a long nap",tired
totally exhausted need rest,tired
I feel hopeful and want uplifting stories,uplifting
"Fuming about the meeting, need to vent and unwind",angry
"lost the plot, need something slick and mysterious",mystery
I feel happy just planning a movie night,happy
"Tired but hopeful, craving a soothing drama",tired
I feel overwhelmed and want a soothing drama,calm
soft and cute romance for a rainy night,romantic
I’m craving a mysterious vibe and clever twists,mystery
need something dark and intense,horror
want something brave and uplifting tonight,uplifting
I want a feel good movie that inspires,uplifting
I'm really sad and could use a friend to talk to,sad
need a good cry session tonight,sad
I’m planning a cozy movie night with romance,romantic
i feel calm and want something soothing,calm
so excited for a feel good movie,happy
give me something thrilling and mysterious,mystery
"my heart's in a soft, romantic mood",romantic
I’m in the mood for a dramatic mystery tonight,mystery
surprise me with a mysterious plot and suspense,mystery
"Work was stressful, so I need a calm vibe",stressed
feel good vibes and charming romance,romantic
"watching something goofy, hoping for loud laughs",comedy
feeling great and wanna chat about fun stuff,happy
"pulling an all-nighter, craving mystery and twists",mystery
I feel hopeful and want a cheerful movie,happy
let's binge on feel-good films,happy
"pretty exhausted, need rest and some comfort",tired
Want a laugh-out-loud comedy to end the day,comedy
"so done with today, need a break",stressed
"I’m craving a funny, goofy comedy this evening",comedy
"heart full, want a gentle romance tonight",romantic
"today wore me out, craving a cozy finish",calm
I’m overwhelmed and need a comforting movie choice,sad
"Feeling stressed after work, need a relaxing break",stressed
I feel happy today and want something fun,happy
so mad right now need to chill,angry
"not sure what to watch, something light",calm
"Feeling calm, just want a chill comedy",calm
"in a moody, gritty mystery mood",mystery
"giggles abound, looking for a lighthearted film",comedy
I’m exhausted but still want something engaging,tired
I’m content and want a feel-good movie,happy
I could go for a mystery flick right now,mystery
"feeling calm and cozy, nothing heavy",calm
"That thriller had me jumpy, I need a mystery",mystery
I’m in the mood for a suspenseful whodunit,mystery
"paranoid but curious, give me a suspenseful ride",mystery
imagine a clever mystery with twists,mystery
feeling a bit overwhelmed and stressed,stressed
"I feel stressed after long day, need a chill pick",stressed
"Feeling tired after the redecorating, craving a soothing film",tired
"so mad right now, deserve a wild comedy",angry
"frustrated and wound tight, looking for something dark",angry
"totally stressed, want something thrilling and dark",stressed
"ready to smile, need a feel-good comedy",happy
I want to watch a scary movie and jump scares,horror
nothing beats a cozy feel good flick,uplifting
want romance and cozy moments together,romantic
i want a tense thriller with twists,mystery
"Feeling tired after a long day, craving chill",tired
"Looking for an uplifting, feel-good film",uplifting
"stressed from work, craving a cozy movie night",stressed
I’m annoyed and want something intense,angry
"Feeling stressed after work, need something relaxing",stressed
I want something calm and soothing tonight,calm
im in the mood for a romantic flick,romantic
"Work was rough, I’m stressed and craving a cozy movie",stressed
i am so tired after work and need a chill vibe,tired
"my mood is sunny, wanna feel good",happy
feeling calm and want a soothing story,calm
in the mood for a sweet romance,romantic
in the mood for a big romantic pick,romantic
"deeply nostalgic, craving a heartfelt drama",sad
that lighthearted comedy would be perfect,comedy
"A quiet movie sounds perfect, something calm",calm
I crave clever humor and smart jokes,comedy
I am in the mood for romance,romantic
"Tired after a long day, want something easygoing",tired
need something thrilling and full of suspense,mystery
"bring on the slapstick, I need a funny one",comedy
I need something scary but thrilling to wind down,horror
I feel beneficially entertained and intrigued,mystery
